{
  "schema_version": "1",
  "scope": {
    "request": "combined briefing page from fixture Feed Items",
    "time_range": {
      "published_after": 1778581000000,
      "published_before": 1778581600000,
      "label": "Fixture Feed Items for combined briefing page eval"
    },
    "candidate_count": 3,
    "active_subscription_count": 3,
    "selection_rule": "Use exactly two Artifact Topic units from the fixture: one for the dual-mode page renderer and one for evidence visibility through the Source Index. Keep the narrative-mode item as supplemental secondary coverage because the request explicitly excludes Show Script creation.",
    "used_contextual_evidence": false
  },
  "units": [
    {
      "id": "dual-mode-renderer",
      "type": "briefing_section",
      "title": "The briefing page is a complete dual-mode local artifact",
      "claim": "A combined Briefing Page should render Newspaper and Narrative modes in one standalone HTML file, using the reviewed Structured Synthesis as its source of truth.",
      "supporting_evidence": [
        {
          "kind": "feed_item",
          "feed_item_id": "item_render_page",
          "url": "https://example.com/briefing-page-renderer",
          "subscription_title": "Artifact Systems",
          "title": "Briefing Pages use a dual-mode renderer",
          "published_at": 1778581000000,
          "relevance": "direct",
          "reason": "States that the combined page includes both Newspaper and Narrative modes, a header switch, dual mode containers, and a footer source index."
        },
        {
          "kind": "feed_item",
          "feed_item_id": "item_narrative_mode",
          "url": "https://example.com/narrative-mode",
          "subscription_title": "Artifact Writing",
          "title": "Narrative mode should not become a Show Script",
          "published_at": 1778581600000,
          "relevance": "supporting",
          "reason": "Clarifies that Narrative Briefing prose is for silent reading and should avoid host turns or spoken pacing."
        }
      ],
      "selection_rationale": "This is the lead Artifact Topic because it defines the requested artifact shape: one local page with both rendering modes and no Show Script.",
      "rendering_priority": "lead"
    },
    {
      "id": "source-index-traceability",
      "type": "insight",
      "title": "Traceability stays visible without making the page feel like an audit",
      "claim": "The Source Index lets the page preserve evidence coverage while the body remains readable and editorial.",
      "supporting_evidence": [
        {
          "kind": "feed_item",
          "feed_item_id": "item_source_index",
          "url": "https://example.com/source-index",
          "subscription_title": "Editorial Tools",
          "title": "Source indexes keep evidence visible without turning pages into audits",
          "published_at": 1778581300000,
          "relevance": "direct",
          "reason": "Explains that briefing pages should keep a complete source index while preserving editorial reading flow."
        },
        {
          "kind": "feed_item",
          "feed_item_id": "item_render_page",
          "url": "https://example.com/briefing-page-renderer",
          "subscription_title": "Artifact Systems",
          "title": "Briefing Pages use a dual-mode renderer",
          "published_at": 1778581000000,
          "relevance": "supporting",
          "reason": "Names the footer source index as part of the standalone combined page structure."
        }
      ],
      "selection_rationale": "This second Artifact Topic captures the evidence and source-index requirement that the rendered page must satisfy.",
      "rendering_priority": "main"
    }
  ],
  "secondary_items": [
    {
      "feed_item_id": "item_narrative_mode",
      "url": "https://example.com/narrative-mode",
      "title": "Narrative mode should not become a Show Script",
      "subscription_title": "Artifact Writing",
      "published_at": 1778581600000,
      "group": "supplemental",
      "reason": "Relevant to the requested no-Show-Script boundary and used as supporting evidence, but not promoted into a third Artifact Topic because the eval requires exactly two units."
    }
  ]
}
